<?xml version="1.0" encoding="UTF-8"?>
<!--XML-Beispieldatei von XMLSpy generiert v2005 rel. 3 U (http://www.altova.com)-->
<SWT xmlns:xsi="http://www.w3.org/2001/XMLSchema-instance" xsi:noNamespaceSchemaLocation="..\Swt.xsd" package="net.ifao.plugins.dialog">
	<Shell name="Select" background="COLOR_LIST_BACKGROUND">
		<Composite numColumns="2" fill="HORIZONTAL" background="COLOR_LIST_BACKGROUND">
			<Composite fill="FULL" background="COLOR_LIST_BACKGROUND">
				<Label text="Select from list below" font="HEADER_FONT"/>
				<Label name="Type" text="..." />
			</Composite>
			<Canvas image="testcase_big.png"/>
		</Composite>
		<Composite border="SHADOW_ETCHED_OUT" fill="FULL" background="COLOR_WIDGET_BACKGROUND">
			<Composite border="SHADOW_ETCHED_IN" fill="FULL" numColumns="2" background="COLOR_WIDGET_LIGHT_SHADOW">
				<Label text="Select:"/>
				<Combo name="Select" fill="HORIZONTAL" border="BORDER"/>
				<Text colSpan="2" name="Comment" fill="FULL" border="SHADOW_ETCHED_OUT" background="COLOR_WIDGET_LIGHT_SHADOW"/>
			</Composite>
		</Composite>
		<Composite numColumns="2" fill="HORIZONTAL" background="COLOR_WIDGET_BACKGROUND">
			<Composite fill="FULL">
			</Composite>
			<Composite numColumns="2">
				<Button name="Finish" text="  OK  " enabled="false" fill="HORIZONTAL"/>
				<Button name="Cancel" text="  Cancel  " fill="HORIZONTAL"/>
			</Composite>
		</Composite>
	</Shell>
</SWT>
