<?xml version="1.0" encoding="UTF-8"?>
<!--XML-Beispieldatei von XMLSpy generiert v2005 rel. 3 U (http://www.altova.com)-->
<SWT xmlns:xsi="http://www.w3.org/2001/XMLSchema-instance" xsi:noNamespaceSchemaLocation="..\..\Swt.xsd" package="net.ifao.plugins.editor.dtdinfo">
	<Shell name="DtdInfo" background="COLOR_WIDGET_BACKGROUND" modal="true">
		<Composite fill="FULL" background="COLOR_WIDGET_LIGHT_SHADOW">
			<Label name="Title" text="Title:" font="HEADER_FONT"/>
			<SashForm name="Sash" sashDirection="HORIZONTAL" fill="FULL">
				<Composite fill="FULL" border="SHADOW_ETCHED_OUT" background="COLOR_WIDGET_BACKGROUND">
					<TabFolder name="ReqRes" fill="FULL">
						<TabItem  text="Request" background="COLOR_LIST_BACKGROUND">
							<Composite>
								<Tree name="Req" fill="FULL" background="COLOR_LIST_BACKGROUND"/>
							</Composite>
						</TabItem>
						<TabItem  text="Response" background="COLOR_LIST_BACKGROUND">
							<Composite>
								<Tree name="Res" fill="FULL" background="COLOR_LIST_BACKGROUND"/>
							</Composite>
						</TabItem>
					</TabFolder>
				</Composite>
				<Composite fill="FULL" background="COLOR_WIDGET_BACKGROUND" border="SHADOW_ETCHED_OUT">
					<Label name="DetailName" text="Name" fill="HORIZONTAL" border="SHADOW_ETCHED_OUT"/>
					<Label name="DetailDescription" text="Description" fill="HORIZONTAL" border="SHADOW_ETCHED_OUT"/>
					<Button type="CHECK" text="Madatory ?" fill="HORIZONTAL"/>
					<Group name="Type" fill="FULL">
						<Composite fill="FULL">
						</Composite>
						<Composite fill="FULL">
							<Button text="DisplayPnrElements" name="DisplayPnrElements" fill="HORIZONTAL"/>
							<Composite fill="FULL" border="SHADOW_ETCHED_IN" background="COLOR_LIST_BACKGROUND">
								<Composite numColumns="3" fill="HORIZONTAL">
									<Label text="Transform Rules" fill="FULL"/>
									<Button name="AdditionalDocument1" text="Additional Document"/>
									<Button name="NotSupported1" text="not supported"/>
								</Composite>
								<Text name="TransformRules1" fill="FULL"/>
							</Composite>
							<Composite fill="FULL" border="SHADOW_ETCHED_IN" background="COLOR_LIST_BACKGROUND">
								<Label text="Provider Ref" fill="HORIZONTAL"/>
								<Text name="ProviderRef1" fill="FULL"/>
							</Composite>
							<Composite fill="HORIZONTAL" border="SHADOW_ETCHED_IN" background="COLOR_LIST_BACKGROUND">
								<Label text="Date (User)" fill="HORIZONTAL"/>
								<Text name="DateUser1" fill="HORIZONTAL" enabled="false"/>
							</Composite>
						</Composite>
						<Composite fill="FULL">
							<Button text="HidePnrElements" name="HidePnrElements" fill="HORIZONTAL"/>
							<Composite name="PnrElementsActive" fill="FULL" border="SHADOW_ETCHED_IN" background="COLOR_LIST_BACKGROUND">
								<Label text="Pnr Elements" fill="HORIZONTAL"/>
								<Composite numColumns="3" fill="HORIZONTAL">
									<Combo name="PnrName" fill="HORIZONTAL"/>
									<Combo name="PnrAttr" fill="HORIZONTAL"/>
									<Button name="UsePnrElement" text="Use"/>
								</Composite>
								<Button name="SelfDefined" text="Create self defined method" type="CHECK" fill="HORIZONTAL"/>
								<Composite fill="FULL" numColumns="2">
									<Text name="DetailPnr" fill="FULL"/>
									<Button name="DetailPnr2" text="Detail ..."/>
								</Composite>
							</Composite>
							<Composite fill="FULL" border="SHADOW_ETCHED_IN" background="COLOR_LIST_BACKGROUND">
								<Composite numColumns="3" fill="HORIZONTAL">
									<Label text="Transform Rules" fill="FULL"/>
									<Button name="AdditionalDocument2" text="Additional Document"/>
									<Button name="NotSupported2" text="not supported"/>
								</Composite>
								<Text name="TransformRules2" fill="FULL"/>
							</Composite>
							<Composite fill="FULL" border="SHADOW_ETCHED_IN" background="COLOR_LIST_BACKGROUND">
								<Label text="Provider Ref" fill="HORIZONTAL"/>
								<Text name="ProviderRef2" fill="FULL"/>
							</Composite>
							<Composite fill="HORIZONTAL" border="SHADOW_ETCHED_IN" background="COLOR_LIST_BACKGROUND">
								<Label text="Date (User)" fill="HORIZONTAL"/>
								<Text name="DateUser2" fill="HORIZONTAL" enabled="false"/>
							</Composite>
						</Composite>
					</Group>
				</Composite>
			</SashForm>
		</Composite>
	</Shell>
</SWT>
